,sectionid,sectionName,date,webTitle,weburl
111,commentisfree,Opinion,2022-03-02 16:00:43+00:00,We must confront Russian propaganda – even when it comes from those we respect | George Monbiot,https://www.theguardian.com/commentisfree/2022/mar/02/russian-propaganda-anti-imperialist-left-vladimir-putin
112,politics,Politics,2022-02-01 14:22:11+00:00,Johnson-Putin call rescheduled as PM’s diplomacy drive falters,https://www.theguardian.com/politics/2022/feb/01/boris-johnson-rebuffed-in-bid-to-play-key-role-in-ukraine-diplomacy
113,commentisfree,Opinion,2022-02-01 16:00:02+00:00,Britain’s failure to tackle Russian dirty money has enabled Putin’s aggression | Nicola Sturgeon,https://www.theguardian.com/commentisfree/2022/feb/01/ukraine-russia-vladimir-putin-boris-johnson-dirty-money
114,commentisfree,Opinion,2022-09-30 14:47:36+00:00,A new series immerses us in Russia’s 90s trauma – and the human cost of economic shock | Marina Hyde,https://www.theguardian.com/commentisfree/2022/sep/30/new-series-russia-90s-adam-curtis-bbc-films-traumazone
115,world,World news,2022-08-31 17:18:34+00:00,Gorbachev was let down by the west. Putin’s Russia is the result | Letters,https://www.theguardian.com/world/2022/aug/31/gorbachev-was-let-down-by-the-west-putins-russia-is-the-result
116,uk-news,UK news,2022-11-16 13:46:43+00:00,MI5 chief: UK will have to tackle Russian aggression ‘for years to come’,https://www.theguardian.com/uk-news/2022/nov/16/mi5-chief-uk-will-have-to-tackle-russian-aggression-for-years-to-come
